{
  "key": "insulated",
  "name": "Insulated",
  "contentSet": "core",
  "description": "When you make a saving throw against an effect that would deal ion or lightning damage while wearing armor or wielding a shield with this property, you can treat a d20 roll of below the insulated number as the insulated number."
}
